French Sentence,English Translation,POS Sequence,Dependency Sequence,Valence,Relative Position
La vie est une symphonie de l'univers.,Life is a symphony of the universe.,DET NOUN AUX DET NOUN ADP DET NOUN PUNCT,"est-nsubj-vie,est-cop-est,est-obj-symphonie,symphonie-det-une,symphonie-nmod-univers,univers-det-l',univers-case-de l',vie-det-la",0.8,2
Nous sommes remplis d'une joie profonde et sincère.,We are filled with a deep and sincere joy.,PRON AUX VERB ADP DET NOUN ADJ CCONJ ADJ PUNCT,"sommes-nsubj-nous,sommes-cop-sommes,sommes-amod-remplis,remplis-obl-joie,joie-det-une,joie-amod-profonde,profonde-conj-sincère,joie-case-d'une",0.9,2
Le bonheur est une fleur qui s'épanouit à chaque instant.,Happiness is a flower that blooms every moment.,DET NOUN AUX DET NOUN PRON VERB ADP DET NOUN PUNCT,"est-nsubj-bonheur,est-cop-est,est-obj-fleur,fleur-det-une,épanouit-nsubj-qui,épanouit-obj-s',épanouit-obl-instant,instant-det-chaque,instant-case-à chaque,bonheur-det-le",0.9,2
Elle danse sous la pluie avec une joie immense.,She dances in the rain with immense joy.,PRON VERB ADP DET NOUN ADP DET NOUN ADJ PUNCT,"danse-nsubj-elle,danse-obl-pluie,pluie-det-la,danse-obl-joie,joie-det-une,joie-amod-immense,joie-case-avec une,pluie-case-sous la",0.9,2
Les cœurs sont remplis de rires et de bonheur.,Hearts are filled with laughter and happiness.,DET NOUN AUX VERB ADP NOUN CCONJ ADP NOUN PUNCT,"sont-nsubj-cœurs,sont-cop-sont,sont-amod-remplis,remplis-obl-rires,rires-conj-bonheur,rires-case-de,bonheur-case-de,cœurs-det-les",0.9,2
C'est une belle journée pour partager la joie.,It's a beautiful day to share joy.,PRON AUX DET ADJ NOUN ADP VERB DET NOUN PUNCT,"est-nsubj-c',est-cop-est,est-obj-journée,journée-det-une,journée-amod-belle,journée-xcomp-partager,partager-obj-joie,joie-det-la,partager-case-pour",0.9,2
La vie est un cadeau à offrir.,Life is a gift to offer.,DET NOUN AUX DET NOUN ADP VERB PUNCT,"est-nsubj-vie,est-cop-est,est-obj-cadeau,cadeau-det-un,cadeau-xcomp-offrir,offrir-case-à,vie-det-la",0.8,2
Nous sommes reconnaissants pour l'amitié et l'amour.,We are grateful for friendship and love.,PRON AUX ADJ ADP DET NOUN CCONJ DET NOUN PUNCT,"sommes-nsubj-nous,sommes-cop-sommes,sommes-amod-reconnaissants,reconnaissants-obl-amitié,amitié-det-l',amitié-conj-amour,amour-det-l',amitié-case-pour l'",0.9,2
Le bonheur est un choix qui transforme la vie.,Happiness is a choice that transforms life.,DET NOUN AUX DET NOUN PRON VERB DET NOUN PUNCT,"est-nsubj-bonheur,est-cop-est,est-obj-choix,choix-det-un,transforme-nsubj-qui,transforme-obj-vie,vie-det-la,bonheur-det-le",0.9,2
Elle sourit avec le soleil et la lune.,She smiles with the sun and the moon.,PRON VERB ADP DET NOUN CCONJ DET NOUN PUNCT,"sourit-nsubj-elle,sourit-obl-soleil,soleil-det-le,soleil-conj-lune,lune-det-la,soleil-case-avec le",0.8,2
Les moments de rire sont une source de bonheur.,Moments of laughter are a source of happiness.,DET NOUN ADP NOUN AUX DET NOUN ADP NOUN PUNCT,"sont-nsubj-moments,moments-nmod-rire,rire-case-de,sont-cop-sont,sont-obj-source,source-det-une,source-nmod-bonheur,bonheur-case-de,moments-det-les",0.9,2
C'est une douce sensation de paix intérieure.,It's a sweet feeling of inner peace.,PRON AUX DET ADJ NOUN ADP ADJ NOUN PUNCT,"est-nsubj-c',est-cop-est,est-obj-sensation,sensation-det-une,sensation-amod-douce,sensation-nmod-paix,paix-amod-intérieure,paix-case-de",0.9,2
La vie est une danse de l'univers.,Life is a dance of the universe.,DET NOUN AUX DET NOUN ADP DET NOUN PUNCT,"est-nsubj-vie,est-cop-est,est-obj-danse,danse-det-une,danse-nmod-univers,univers-det-l',univers-case-de l',vie-det-la",0.8,2
Nous sommes comblés par la joie et la paix.,We are filled with joy and peace.,PRON AUX VERB ADP DET NOUN CCONJ DET NOUN PUNCT,"sommes-nsubj-nous,sommes-cop-sommes,sommes-amod-comblés,comblés-obl-joie,joie-det-la,joie-conj-paix,paix-det-la,joie-case-par la",0.9,2
Le bonheur est une lumière qui éclaire le monde.,Happiness is a light that illuminates the world.,DET NOUN AUX DET NOUN PRON VERB DET NOUN PUNCT,"est-nsubj-bonheur,est-cop-est,est-obj-lumière,lumière-det-une,éclaire-nsubj-qui,éclaire-obj-monde,monde-det-le,bonheur-det-le",0.9,2
Elle danse avec son âme.,She dances with her soul.,PRON VERB ADP DET NOUN PUNCT,"danse-nsubj-elle,danse-obl-âme,âme-det-son,âme-case-avec son",0.8,2
Les rires sont le reflet du bonheur.,Laughter is the reflection of happiness.,DET NOUN AUX DET NOUN ADP DET NOUN PUNCT,"sont-nsubj-rires,sont-cop-sont,sont-obj-reflet,reflet-det-le,reflet-nmod-bonheur,bonheur-case-du,rires-det-les",0.9,2
C'est un sentiment de joie profonde et sincère.,It's a feeling of deep and sincere joy.,PRON AUX DET NOUN ADP NOUN ADJ CCONJ ADJ PUNCT,"est-nsubj-c',est-cop-est,est-obj-sentiment,sentiment-det-un,sentiment-nmod-joie,joie-amod-profonde,profonde-conj-sincère,joie-case-de",0.9,2
La vie est un voyage de découverte et de joie.,Life is a journey of discovery and joy.,DET NOUN AUX DET NOUN ADP NOUN CCONJ ADP NOUN PUNCT,"est-nsubj-vie,est-cop-est,est-obj-voyage,voyage-det-un,voyage-nmod-découverte,découverte-conj-joie,découverte-case-de,joie-case-de,vie-det-la",0.9,2
Nous sommes reconnaissants pour chaque instant de paix et de bonheur.,We are grateful for every moment of peace and happiness.,PRON AUX ADJ ADP DET NOUN ADP NOUN CCONJ ADP NOUN PUNCT,"sommes-nsubj-nous,sommes-cop-sommes,sommes-amod-reconnaissants,reconnaissants-obl-moment,moment-det-chaque,moment-nmod-paix,paix-conj-bonheur,paix-case-de,bonheur-case-de,moment-case-pour",0.9,2
Le bonheur est un art de vivre et de partager la joie.,Happiness is an art of living and sharing joy.,DET NOUN AUX DET NOUN ADP VERB CCONJ ADP VERB DET NOUN PUNCT,"est-nsubj-bonheur,est-cop-est,est-obj-art,art-det-un,art-nmod-vivre,vivre-case-de,vivre-conj-partager,partager-case-de,partager-obj-joie,joie-det-la,bonheur-det-le",0.9,2
"Elle chante sa vie avec passion, joie et amour.","She sings her life with passion, joy, and love.",PRON VERB DET NOUN ADP NOUN PUNCT NOUN CCONJ NOUN PUNCT,"chante-nsubj-elle,chante-obj-vie,vie-det-sa,chante-obl-passion,passion-conj-joie,joie-conj-amour,passion-case-avec",0.9,2
Les oiseaux chantent la vie et l'espoir.,Birds sing life and hope.,DET NOUN VERB DET NOUN CCONJ DET NOUN PUNCT,"chantent-nsubj-oiseaux,chantent-obj-vie,vie-det-la,vie-conj-espoir,espoir-det-l',oiseaux-det-les",0.8,2
"C'est un moment de pur enchantement, de paix et de bonheur.","It's a moment of pure enchantment, peace, and happiness.",PRON AUX DET NOUN ADP ADJ NOUN PUNCT ADP NOUN CCONJ ADP NOUN PUNCT,"est-nsubj-c',est-cop-est,est-obj-moment,moment-det-un,moment-nmod-enchantement,enchantement-amod-pur,enchantement-conj-paix,paix-conj-bonheur,enchantement-case-de,paix-case-de,bonheur-case-de",0.9,2
La vie est une symphonie d'harmonie et de joie.,Life is a symphony of harmony and joy.,DET NOUN AUX DET NOUN ADP NOUN CCONJ ADP NOUN PUNCT,"est-nsubj-vie,est-cop-est,est-obj-symphonie,symphonie-det-une,symphonie-nmod-harmonie,harmonie-conj-joie,harmonie-case-d',joie-case-de,vie-det-la",0.9,2
"Nous sommes remplis d'une joie profonde, durable et sincère.","We are filled with a deep, lasting, and sincere joy.",PRON AUX VERB ADP DET NOUN ADJ PUNCT ADJ CCONJ ADJ PUNCT,"sommes-nsubj-nous,sommes-cop-sommes,sommes-amod-remplis,remplis-obl-joie,joie-det-une,joie-amod-profonde,profonde-conj-durable,durable-conj-sincère,joie-case-d'une",0.9,2
Le bonheur est une fleur qui s'épanouit à chaque instant de vie.,Happiness is a flower that blooms every moment of life.,DET NOUN AUX DET NOUN PRON VERB ADP DET NOUN ADP NOUN PUNCT,"est-nsubj-bonheur,est-cop-est,est-obj-fleur,fleur-det-une,épanouit-nsubj-qui,épanouit-obj-s',épanouit-obl-instant,instant-det-chaque,instant-nmod-vie,vie-case-de,instant-case-à chaque,bonheur-det-le",0.9,2
Elle danse sous la pluie avec une joie immense et contagieuse.,She dances in the rain with immense and contagious joy.,PRON VERB ADP DET NOUN ADP DET NOUN ADJ CCONJ ADJ PUNCT,"danse-nsubj-elle,danse-obl-pluie,pluie-det-la,danse-obl-joie,joie-det-une,joie-amod-immense,immense-conj-contagieuse,joie-case-avec une,pluie-case-sous la",0.9,2
"Les cœurs sont remplis de rires, de bonheur et de lumière.","Hearts are filled with laughter, happiness, and light.",DET NOUN AUX VERB ADP NOUN PUNCT ADP NOUN CCONJ ADP NOUN PUNCT,"sont-nsubj-cœurs,sont-cop-sont,sont-amod-remplis,remplis-obl-rires,rires-conj-bonheur,bonheur-conj-lumière,rires-case-de,bonheur-case-de,lumière-case-de,cœurs-det-les",0.9,2
C'est une belle journée pour partager la joie et l'amour.,It's a beautiful day to share joy and love.,PRON AUX DET ADJ NOUN ADP VERB DET NOUN CCONJ DET NOUN PUNCT,"est-nsubj-c',est-cop-est,est-obj-journée,journée-det-une,journée-amod-belle,journée-xcomp-partager,partager-obj-joie,joie-det-la,joie-conj-amour,amour-det-l',partager-case-pour",0.9,2
La vie est un cadeau à offrir et à chérir.,Life is a gift to offer and cherish.,DET NOUN AUX DET NOUN ADP VERB CCONJ ADP VERB PUNCT,"est-nsubj-vie,est-cop-est,est-obj-cadeau,cadeau-det-un,cadeau-xcomp-offrir,offrir-conj-chérir,offrir-case-à,chérir-case-à,vie-det-la",0.8,2
"Nous sommes reconnaissants pour l'amitié, l'amour et la vie.","We are grateful for friendship, love, and life.",PRON AUX ADJ ADP DET NOUN PUNCT DET NOUN CCONJ DET NOUN PUNCT,"sommes-nsubj-nous,sommes-cop-sommes,sommes-amod-reconnaissants,reconnaissants-obl-amitié,amitié-det-l',amitié-conj-amour,amour-det-l',amour-conj-vie,vie-det-la,amitié-case-pour l'",0.9,2
Le bonheur est un choix qui transforme la vie et l'âme.,Happiness is a choice that transforms life and soul.,DET NOUN AUX DET NOUN PRON VERB DET NOUN CCONJ DET NOUN PUNCT,"est-nsubj-bonheur,est-cop-est,est-obj-choix,choix-det-un,transforme-nsubj-qui,transforme-obj-vie,vie-det-la,vie-conj-âme,âme-det-l',bonheur-det-le",0.9,2
"Elle sourit avec le soleil, la lune et les étoiles.","She smiles with the sun, the moon, and the stars.",PRON VERB ADP DET NOUN PUNCT DET NOUN CCONJ DET NOUN PUNCT,"sourit-nsubj-elle,sourit-obl-soleil,soleil-det-le,soleil-conj-lune,lune-det-la,lune-conj-étoiles,étoiles-det-les,soleil-case-avec le",0.8,2
Les moments de rire sont une source de guérison et de bonheur.,Moments of laughter are a source of healing and happiness.,DET NOUN ADP NOUN AUX DET NOUN ADP NOUN CCONJ ADP NOUN PUNCT,"sont-nsubj-moments,moments-nmod-rire,rire-case-de,sont-cop-sont,sont-obj-source,source-det-une,source-nmod-guérison,guérison-conj-bonheur,guérison-case-de,bonheur-case-de,moments-det-les",0.9,2
C'est une douce sensation de liberté et de paix.,It's a sweet feeling of freedom and peace.,PRON AUX DET ADJ NOUN ADP NOUN CCONJ ADP NOUN PUNCT,"est-nsubj-c',est-cop-est,est-obj-sentiment,sentiment-det-un,sentiment-amod-douce,sentiment-nmod-liberté,liberté-conj-paix,liberté-case-de,paix-case-de",0.9,2
La vie est une danse de l'existence et de la joie.,Life is a dance of existence and joy.,DET NOUN AUX DET NOUN ADP DET NOUN CCONJ ADP DET NOUN PUNCT,"est-nsubj-vie,est-cop-est,est-obj-danse,danse-det-une,danse-nmod-existence,existence-conj-joie,existence-det-l',existence-case-de l',joie-det-la,joie-case-de la,vie-det-la",0.9,2
Nous sommes comblés par la joie de vivre et de partager.,We are filled with the joy of living and sharing.,PRON AUX VERB ADP DET NOUN ADP VERB CCONJ ADP VERB PUNCT,"sommes-nsubj-nous,sommes-cop-sommes,sommes-amod-comblés,comblés-obl-joie,joie-det-la,joie-nmod-vivre,vivre-conj-partager,vivre-case-de,partager-case-de,joie-case-par la",0.9,2
Le bonheur est une lumière qui brille en nous et autour de nous.,Happiness is a light that shines within us and around us.,DET NOUN AUX DET NOUN PRON VERB ADP PRON CCONJ ADV ADP PRON PUNCT,"est-nsubj-bonheur,est-cop-est,est-obj-lumière,lumière-det-une,brille-nsubj-qui,brille-obl-nous,brille-obl-nous,nous-case-en,nous-case-autour de,bonheur-det-le",0.9,2
Elle danse avec son cœur et son âme.,She dances with her heart and soul.,PRON VERB ADP DET NOUN CCONJ DET NOUN PUNCT,"danse-nsubj-elle,danse-obl-cœur,cœur-det-son,cœur-conj-âme,âme-det-son,cœur-case-avec son",0.9,2
Les rires sont le plus beau des cadeaux et des bénédictions.,Laughter is the most beautiful gift and blessing.,DET NOUN AUX DET ADJ ADP DET NOUN CCONJ ADP DET NOUN PUNCT,"sont-nsubj-rires,sont-cop-sont,sont-obj-cadeaux,cadeaux-det-le plus beau,cadeaux-conj-bénédictions,cadeaux-case-des,bénédictions-case-des,rires-det-les",0.9,2
C'est un sentiment de bonheur infini et éternel.,It's a feeling of infinite and eternal happiness.,PRON AUX DET NOUN ADP NOUN ADJ CCONJ ADJ PUNCT,"est-nsubj-c',est-cop-est,est-obj-sentiment,sentiment-det-un,sentiment-nmod-bonheur,bonheur-amod-infini,infini-conj-éternel,bonheur-case-de",0.9,2
"La vie est un voyage de découverte, de croissance et de joie.","Life is a journey of discovery, growth, and joy.",DET NOUN AUX DET NOUN ADP NOUN PUNCT ADP NOUN CCONJ ADP NOUN PUNCT,"est-nsubj-vie,est-cop-est,est-obj-voyage,voyage-det-un,voyage-nmod-découverte,découverte-conj-croissance,croissance-conj-joie,découverte-case-de,croissance-case-de,joie-case-de,vie-det-la",0.9,2
"Nous sommes reconnaissants pour chaque instant de vie, de paix et de bonheur.","We are grateful for every moment of life, peace, and happiness.",PRON AUX ADJ ADP DET NOUN ADP NOUN PUNCT ADP NOUN CCONJ ADP NOUN PUNCT,"sommes-nsubj-nous,sommes-cop-sommes,sommes-amod-reconnaissants,reconnaissants-obl-moment,moment-det-chaque,moment-nmod-vie,vie-conj-paix,paix-conj-bonheur,vie-case-de,paix-case-de,bonheur-case-de,moment-case-pour",0.9,2
"Le bonheur est un art de vivre, de partager et de sourire.","Happiness is an art of living, sharing, and smiling.",DET NOUN AUX DET NOUN ADP VERB PUNCT ADP VERB CCONJ ADP VERB PUNCT,"est-nsubj-bonheur,est-cop-est,est-obj-art,art-det-un,art-nmod-vivre,vivre-conj-partager,partager-conj-sourire,vivre-case-de,partager-case-de,sourire-case-de,bonheur-det-le",0.9,2
"Elle chante sa vie avec passion, joie, amour et liberté.","She sings her life with passion, joy, love, and freedom.",PRON VERB DET NOUN ADP NOUN PUNCT NOUN PUNCT NOUN CCONJ NOUN PUNCT,"chante-nsubj-elle,chante-obj-vie,vie-det-sa,chante-obl-passion,passion-conj-joie,joie-conj-amour,amour-conj-liberté,passion-case-avec",0.9,2
"Les oiseaux chantent la vie, l'espoir et la paix.","Birds sing life, hope, and peace.",DET NOUN VERB DET NOUN PUNCT DET NOUN CCONJ DET NOUN PUNCT,"chantent-nsubj-oiseaux,chantent-obj-vie,vie-det-la,vie-conj-espoir,espoir-det-l',espoir-conj-paix,paix-det-la,oiseaux-det-les",0.8,2
"C'est un moment de pur enchantement, de paix, de bonheur et d'harmonie.","It's a moment of pure enchantment, peace, happiness, and harmony.",PRON AUX DET NOUN ADP ADJ NOUN PUNCT ADP NOUN PUNCT ADP NOUN CCONJ ADP NOUN PUNCT,"est-nsubj-c',est-cop-est,est-obj-moment,moment-det-un,moment-nmod-enchantement,enchantement-amod-pur,enchantement-conj-paix,paix-conj-bonheur,bonheur-conj-harmonie,enchantement-case-de,paix-case-de,bonheur-case-de,harmonie-case-d',moment-det-un",0.9,2
"La vie est une symphonie d'harmonie, de joie et d'amour.","Life is a symphony of harmony, joy, and love.",DET NOUN AUX DET NOUN ADP NOUN PUNCT ADP NOUN CCONJ ADP NOUN PUNCT,"est-nsubj-vie,est-cop-est,est-obj-symphonie,symphonie-det-une,symphonie-nmod-harmonie,harmonie-conj-joie,joie-conj-amour,harmonie-case-d',joie-case-de,amour-case-d',vie-det-la",0.9,2
"Nous sommes remplis d'une joie profonde, durable, sincère et infinie.","We are filled with a deep, lasting, sincere, and infinite joy.",PRON AUX VERB ADP DET NOUN ADJ PUNCT ADJ PUNCT ADJ CCONJ ADJ PUNCT,"sommes-nsubj-nous,sommes-cop-sommes,sommes-amod-remplis,remplis-obl-joie,joie-det-une,joie-amod-profonde,profonde-conj-durable,durable-conj-sincère,sincère-conj-infinie,joie-case-d'une",0.9,2
"Le bonheur est une fleur qui s'épanouit à chaque instant de vie, de paix et de lumière.","Happiness is a flower that blooms every moment of life, peace, and light.",DET NOUN AUX DET NOUN PRON VERB ADP DET NOUN ADP NOUN PUNCT ADP NOUN CCONJ ADP NOUN PUNCT,"est-nsubj-bonheur,est-cop-est,est-obj-fleur,fleur-det-une,épanouit-nsubj-qui,épanouit-obj-s',épanouit-obl-instant,instant-det-chaque,instant-nmod-vie,vie-conj-paix,paix-conj-lumière,vie-case-de,paix-case-de,lumière-case-de,instant-case-à chaque,bonheur-det-le",0.9,2
"Elle danse sous la pluie avec une joie immense, contagieuse et communicative.","She dances in the rain with immense, contagious, and communicative joy.",PRON VERB ADP DET NOUN ADP DET NOUN ADJ PUNCT ADJ CCONJ ADJ PUNCT,"danse-nsubj-elle,danse-obl-pluie,pluie-det-la,danse-obl-joie,joie-det-une,joie-amod-immense,immense-conj-contagieuse,contagieuse-conj-communicative,joie-case-avec une,pluie-case-sous la",0.9,2
"Les cœurs sont remplis de rires, de bonheur, de lumière et de tendresse.","Hearts are filled with laughter, happiness, light, and tenderness.",DET NOUN AUX VERB ADP NOUN PUNCT ADP NOUN PUNCT ADP NOUN CCONJ ADP NOUN PUNCT,"sont-nsubj-cœurs,sont-cop-sont,sont-amod-remplis,remplis-obl-rires,rires-conj-bonheur,bonheur-conj-lumière,lumière-conj-tendresse,rires-case-de,bonheur-case-de,lumière-case-de,tendresse-case-de,cœurs-det-les",0.9,2
"C'est une belle journée pour partager la joie, l'amour et la paix.","It's a beautiful day to share joy, love, and peace.",PRON AUX DET ADJ NOUN ADP VERB DET NOUN PUNCT DET NOUN CCONJ DET NOUN PUNCT,"est-nsubj-c',est-cop-est,est-obj-journée,journée-det-une,journée-amod-belle,journée-xcomp-partager,partager-obj-joie,joie-det-la,joie-conj-amour,amour-det-l',amour-conj-paix,paix-det-la,partager-case-pour",0.9,2
"La vie est un cadeau à offrir, à chérir et à célébrer.","Life is a gift to offer, cherish, and celebrate.",DET NOUN AUX DET NOUN ADP VERB PUNCT ADP VERB CCONJ ADP VERB PUNCT,"est-nsubj-vie,est-cop-est,est-obj-cadeau,cadeau-det-un,cadeau-xcomp-offrir,offrir-conj-chérir,chérir-conj-célébrer,offrir-case-à,chérir-case-à,célébrer-case-à,vie-det-la",0.9,2
"Nous sommes reconnaissants pour l'amitié, l'amour, la vie et la paix.","We are grateful for friendship, love, life, and peace.",PRON AUX ADJ ADP DET NOUN PUNCT DET NOUN PUNCT DET NOUN CCONJ DET NOUN PUNCT,"sommes-nsubj-nous,sommes-cop-sommes,sommes-amod-reconnaissants,reconnaissants-obl-amitié,amitié-det-l',amitié-conj-amour,amour-det-l',amour-conj-vie,vie-det-la,vie-conj-paix,paix-det-la,amitié-case-pour l'",0.9,2
"Le bonheur est un choix qui transforme la vie, l'âme et le monde.","Happiness is a choice that transforms life, soul, and world.",DET NOUN AUX DET NOUN PRON VERB DET NOUN PUNCT DET NOUN CCONJ DET NOUN PUNCT,"est-nsubj-bonheur,est-cop-est,est-obj-choix,choix-det-un,transforme-nsubj-qui,transforme-obj-vie,vie-det-la,vie-conj-âme,âme-det-l',âme-conj-monde,monde-det-le,bonheur-det-le",0.9,2
"Elle sourit avec le soleil, la lune, les étoiles et le cœur.","She smiles with the sun, the moon, the stars, and her heart.",PRON VERB ADP DET NOUN PUNCT DET NOUN PUNCT DET NOUN CCONJ DET NOUN PUNCT,"sourit-nsubj-elle,sourit-obl-soleil,soleil-det-le,soleil-conj-lune,lune-det-la,lune-conj-étoiles,étoiles-det-les,étoiles-conj-cœur,cœur-det-le,soleil-case-avec le",0.8,2
"Les moments de rire sont une source de guérison, de bonheur et de lumière.","Moments of laughter are a source of healing, happiness, and light.",DET NOUN ADP NOUN AUX DET NOUN ADP NOUN PUNCT ADP NOUN CCONJ ADP NOUN PUNCT,"sont-nsubj-moments,moments-nmod-rire,rire-case-de,sont-cop-sont,sont-obj-source,source-det-une,source-nmod-guérison,guérison-conj-bonheur,bonheur-conj-lumière,guérison-case-de,bonheur-case-de,lumière-case-de,moments-det-les",0.9,2
"C'est une douce sensation de liberté, de paix et de joie.","It's a sweet feeling of freedom, peace, and joy.",PRON AUX DET ADJ NOUN ADP NOUN PUNCT ADP NOUN CCONJ ADP NOUN PUNCT,"est-nsubj-c',est-cop-est,est-obj-sentiment,sentiment-det-un,sentiment-amod-douce,sentiment-nmod-liberté,liberté-conj-paix,paix-conj-joie,liberté-case-de,paix-case-de,joie-case-de",0.9,2
"La vie est une danse de l'existence, de la joie et de l'amour.","Life is a dance of existence, joy, and love.",DET NOUN AUX DET NOUN ADP DET NOUN PUNCT ADP DET NOUN CCONJ ADP DET NOUN PUNCT,"est-nsubj-vie,est-cop-est,est-obj-danse,danse-det-une,danse-nmod-existence,existence-conj-joie,joie-conj-amour,existence-det-l',existence-case-de l',joie-det-la,joie-case-de la,amour-det-l',amour-case-de l',vie-det-la",0.9,2
"Nous sommes comblés par la joie de vivre, de partager et de sourire.","We are filled with the joy of living, sharing, and smiling.",PRON AUX VERB ADP DET NOUN ADP VERB PUNCT ADP VERB CCONJ ADP VERB PUNCT,"sommes-nsubj-nous,sommes-cop-sommes,sommes-amod-comblés,comblés-obl-joie,joie-det-la,joie-nmod-vivre,vivre-conj-partager,partager-conj-sourire,vivre-case-de,partager-case-de,sourire-case-de,joie-case-par la",0.9,2
"Le bonheur est une lumière qui brille en nous, autour de nous et pour nous.","Happiness is a light that shines within us, around us, and for us.",DET NOUN AUX DET NOUN PRON VERB ADP PRON PUNCT ADV ADP PRON CCONJ ADP PRON PUNCT,"est-nsubj-bonheur,est-cop-est,est-obj-lumière,lumière-det-une,brille-nsubj-qui,brille-obl-nous,brille-obl-nous,brille-obl-nous,nous-case-en,nous-case-autour de,nous-case-pour,bonheur-det-le",0.9,2
"Elle danse avec son cœur, son âme et son esprit.","She dances with her heart, soul, and spirit.",PRON VERB ADP DET NOUN PUNCT DET NOUN CCONJ DET NOUN PUNCT,"danse-nsubj-elle,danse-obl-cœur,cœur-det-son,cœur-conj-âme,âme-det-son,âme-conj-esprit,esprit-det-son,cœur-case-avec son",0.9,2
"Les rires sont le plus beau des cadeaux, des bénédictions et des surprises.","Laughter is the most beautiful gift, blessing, and surprise.",DET NOUN AUX DET ADJ ADP DET NOUN PUNCT ADP DET NOUN CCONJ ADP DET NOUN PUNCT,"sont-nsubj-rires,sont-cop-sont,sont-obj-cadeaux,cadeaux-det-le plus beau,cadeaux-conj-bénédictions,bénédictions-conj-surprises,cadeaux-case-des,bénédictions-case-des,surprises-case-des,rires-det-les",0.9,2
"C'est un sentiment de bonheur infini, éternel et pur.","It's a feeling of infinite, eternal, and pure happiness.",PRON AUX DET NOUN ADP NOUN ADJ PUNCT ADJ CCONJ ADJ PUNCT,"est-nsubj-c',est-cop-est,est-obj-sentiment,sentiment-det-un,sentiment-nmod-bonheur,bonheur-amod-infini,infini-conj-éternel,éternel-conj-pur,bonheur-case-de",0.9,2
"La vie est un voyage de découverte, de croissance, de joie et d'amour.","Life is a journey of discovery, growth, joy, and love.",DET NOUN AUX DET NOUN ADP NOUN PUNCT ADP NOUN PUNCT ADP NOUN CCONJ ADP NOUN PUNCT,"est-nsubj-vie,est-cop-est,est-obj-voyage,voyage-det-un,voyage-nmod-découverte,découverte-conj-croissance,croissance-conj-joie,joie-conj-amour,découverte-case-de,croissance-case-de,joie-case-de,amour-case-d',vie-det-la",0.9,2
"Nous sommes reconnaissants pour chaque instant de vie, de paix, de bonheur et d'amour.","We are grateful for every moment of life, peace, happiness, and love.",PRON AUX ADJ ADP DET NOUN ADP NOUN PUNCT ADP NOUN CCONJ ADP NOUN PUNCT,"sommes-nsubj-nous,sommes-cop-sommes,sommes-amod-reconnaissants,reconnaissants-obl-moment,moment-det-chaque,moment-nmod-vie,vie-conj-paix,paix-conj-bonheur,bonheur-conj-amour,vie-case-de,paix-case-de,bonheur-case-de,amour-case-d',moment-case-pour",0.9,2
"Le bonheur est un art de vivre, de partager, de sourire et d'aimer.","Happiness is an art of living, sharing, smiling, and loving.",DET NOUN AUX DET NOUN ADP VERB PUNCT ADP VERB PUNCT ADP VERB CCONJ ADP VERB PUNCT,"est-nsubj-bonheur,est-cop-est,est-obj-art,art-det-un,art-nmod-vivre,vivre-conj-partager,partager-conj-sourire,sourire-conj-aimer,vivre-case-de,partager-case-de,sourire-case-de,aimer-case-d',bonheur-det-le",0.9,2
"Elle chante sa vie avec passion, joie, amour, liberté et espoir.","She sings her life with passion, joy, love, freedom, and hope.",PRON VERB DET NOUN ADP NOUN PUNCT NOUN PUNCT NOUN PUNCT NOUN CCONJ NOUN PUNCT,"chante-nsubj-elle,chante-obj-vie,vie-det-sa,chante-obl-passion,passion-conj-joie,joie-conj-amour,amour-conj-liberté,liberté-conj-espoir,passion-case-avec",0.9,2
"Les oiseaux chantent la vie, l'espoir, la paix et l'amour.","Birds sing life, hope, peace, and love.",DET NOUN VERB DET NOUN PUNCT DET NOUN PUNCT DET NOUN CCONJ DET NOUN PUNCT,"chantent-nsubj-oiseaux,chantent-obj-vie,vie-det-la,vie-conj-espoir,espoir-det-l',espoir-conj-paix,paix-det-la,paix-conj-amour,amour-det-l',oiseaux-det-les",0.9,2
"C'est un moment de pur enchantement, de paix, de bonheur, d'harmonie et d'amour.","It's a moment of pure enchantment, peace, happiness, harmony, and love.",PRON AUX DET NOUN ADP ADJ NOUN PUNCT ADP NOUN PUNCT ADP NOUN PUNCT ADP NOUN CCONJ ADP NOUN PUNCT,"est-nsubj-c',est-cop-est,est-obj-moment,moment-det-un,moment-nmod-enchantement,enchantement-amod-pur,enchantement-conj-paix,paix-conj-bonheur,bonheur-conj-harmonie,harmonie-conj-amour,enchantement-case-de,paix-case-de,bonheur-case-de,harmonie-case-d',amour-case-d',moment-det-un",0.9,2
"La vie est une symphonie d'harmonie, de joie, d'amour et de paix.","Life is a symphony of harmony, joy, love, and peace.",DET NOUN AUX DET NOUN ADP NOUN PUNCT ADP NOUN PUNCT ADP NOUN CCONJ ADP NOUN PUNCT,"est-nsubj-vie,est-cop-est,est-obj-symphonie,symphonie-det-une,symphonie-nmod-harmonie,harmonie-conj-joie,joie-conj-amour,amour-conj-paix,harmonie-case-d',joie-case-de,amour-case-d',paix-case-de,vie-det-la",0.9,2
"Nous sommes remplis d'une joie profonde, durable, sincère, infinie et éternelle.","We are filled with a deep, lasting, sincere, infinite, and eternal joy.",PRON AUX VERB ADP DET NOUN ADJ PUNCT ADJ PUNCT ADJ PUNCT ADJ CCONJ ADJ PUNCT,"sommes-nsubj-nous,sommes-cop-sommes,sommes-amod-remplis,remplis-obl-joie,joie-det-une,joie-amod-profonde,profonde-conj-durable,durable-conj-sincère,sincère-conj-infinie,infinie-conj-éternelle,joie-case-d'une",0.9,2
